{
  "schema": "pncw-real-4096d-evidence/v0.1",
  "freshHdsrcRuntimeExecuted": true,
  "hdsrcReleaseSha256": "583659487a25cd76a7a3a32a35fda373074e630c3f7f60e47c618358bbb1c217",
  "source": {
    "id": "state:4096",
    "revision": 10,
    "digest": "sha256:ea48a90eddc727b1684cf72204ddeaa720c6b67fe036561e05537622b0c12f85",
    "dimension": 4096,
    "nodeCount": 72,
    "relationCount": 576
  },
  "decision": {
    "confidence": {
      "mode": "empirical",
      "reason": "outside_current_trust_region",
      "requiresOracle": true
    },
    "decision": "oracle_fallback",
    "schema": "hdsrc-materialization-decision/v1"
  },
  "materialization": {
    "id": "mat:5473af99f81c9810984cafaaac4bf31837c768dcfad517b6fdab81408128a4f8",
    "carrierProfile": "HMBT1",
    "logicalScale": 32,
    "spatializationId": "RCM_PP",
    "materializationDigest": "sha256:4127f98f00cca7d85d2975e13186a2373814dbe0b53d611cf74215695e9e6c5b"
  },
  "partial": {
    "compressedBytesRead": 1272,
    "carrierBytes": 286313,
    "relationCount": 256,
    "payloadDigest": "sha256:38497b2b8aed442318892b13000213c7c137d278edb6cf1486af890540352877"
  },
  "pncw": {
    "resultId": "pncw:result:096296cee4e33f565198c658c60fe78f7881437916fe807dfd3b7f6ca5bd1f8f",
    "manifestDigest": "sha256:c8d2ad40603774629d147624efa2ba748b822830488b10acdc1ab616c36eb28d",
    "verificationDigest": "sha256:7948a833d6a6701cd8152966924a917ed212c9770f7f51227d26546c1453ce62",
    "visibilityCommitId": "pncw:visibility:d7f9330b84ca08287beba7f6bbffa5c1220bcda709b5ba92c0d796464fa2bafb"
  },
  "visibility": {
    "state": "VISIBLE",
    "residentFraction": 0.0000034926688880040796,
    "events": 1
  },
  "mrmic": {
    "mode": "source-grounded-portal-factory",
    "actualCheckoutExecuted": false,
    "upstreamCompatibility": "MRMIC Phase 14 portal shape"
  },
  "semanticEvidenceDigest": "sha256:8eb4c800332a80990bb7623cac4a8df84483fe0687c2e44715edca4dfec7487b"
}
